Timestamp,entry
2026-06-18 09:00:00,/demo/klima | Klimawandel>
2026-06-18 09:00:01,/demo/klima/co2_anstieg | Der CO2-Gehalt in der Atmosphäre steigt seit 1850 kontinuierlich an!
2026-06-18 09:00:02,/demo/klima/ursache | Menschliche Emissionen sind die Hauptursache des aktuellen CO2-Anstiegs!
2026-06-18 09:00:03,/demo/klima/modelle_falsch | Die Klimamodelle übertreiben den Temperaturanstieg massiv!-
2026-06-18 09:00:04,/demo/klima/unsicher | Wie stark werden Extremwetterereignisse zunehmen?
2026-06-18 09:00:05,/demo/klima/gegenfrage | Sind alle zitierten Studien peer-reviewed??
2026-06-18 09:00:06,/demo/klima/meinung | Wir sollten jetzt handeln, auch wenn die Kosten kurzfristig hoch sind.
